{
  "$schema": "https://json-schema.org/draft/2020-12/schema",
  "title": "W4 external tool case family",
  "description": "Use ${run_id}, ${owner}, ${cross}, and ${transport} in case strings; the driver expands them to the exact fixture run before execution. EXPLAIN cases may assert their dynamic server-generated statement id and plan ownership.",
  "type": "array",
  "items": {
    "type": "object",
    "additionalProperties": false,
    "required": ["case_id", "tool", "level", "transports", "requires", "setup", "call", "expect", "db_reread", "audit_expect", "on_unsupported"],
    "properties": {
      "case_id": {"type": "string", "pattern": "^(w4|rel012)_([a-z0-9_]+)$"},
      "tool": {"type": "string", "minLength": 1},
      "test_id": {"type": "string", "pattern": "^w4_[a-z0-9_]+$"},
      "level": {"enum": ["READ_ONLY", "READ_WRITE", "DDL", "ADMIN"]},
      "profile_variant": {"enum": ["masked", "synthetic_raw", "synthetic_owner", "synthetic_owner_short", "synthetic_owner_rw", "synthetic_cross_rw", "synthetic_cross_rw_strict", "protected", "capped_rw", "trusted_views"]},
      "runtime_timeout_probe": {"const": true},
      "name_alias_matrix": {"const": true},
      "mask_certificate_audit": {"const": true},
      "catalog_rows_positive": {"const": true},
      "view_proof_audit": {"type": "array", "minItems": 1, "uniqueItems": true,
        "items": {"type": "string", "minLength": 3}},
      "plan_contains": {"type": "string", "minLength": 1},
      "transports": {"type": "array", "minItems": 1, "uniqueItems": true, "items": {"enum": ["stdio", "http"]}},
      "requires": {"type": "array", "uniqueItems": true, "items": {"type": "string"}},
      "setup": {"type": "array", "items": {"type": "object", "additionalProperties": false,
        "required": ["sql"], "properties": {"sql": {"type": "string", "minLength": 1}}}},
      "setup_phase": {"enum": ["before_call", "before_server"]},
      "setup_ready_sql": {"type": "string", "minLength": 1},
      "flashback_grant_owner": {"const": true},
      "audit_optional_prefix": {"type": "object", "additionalProperties": false,
        "required": ["record", "max_count", "reason"], "properties": {
          "record": {"const": {"tool": "scn_capability_probe", "decision": "ALLOWED", "outcome": "FAILED",
            "failure": {"error_class": "FLASHBACK_CAPABILITY_UNAVAILABLE"}}},
          "max_count": {"const": 1}, "reason": {"type": "string", "minLength": 1}
        }},
      "call": {"type": "object", "required": ["arguments"], "additionalProperties": false, "properties": {
        "generated_sampler_absent": {"const": true},
        "queued_read": {"type": "object", "additionalProperties": false,
          "required": ["hold_marker", "arguments", "expired_marker"], "properties": {
            "hold_marker": {"type": "string", "pattern": "^W4MARK_[A-Z0-9]{12,32}$"},
            "expired_marker": {"type": "string", "pattern": "^W4MARK_[A-Z0-9]{12,32}$"},
            "arguments": {"type": "object", "required": ["sql", "timeout_seconds"],
              "properties": {"sql": {"type": "string", "minLength": 1}, "timeout_seconds": {"const": 1}}}
          }},
        "arguments": {"type": "object"}, "raw_arguments": {"type": "string"},
        "baseline_arguments": {"type": "object"},
        "contract_baseline": {"type": "object"},
        "vsql_absent_marker": {"type": "string", "pattern": "^W4MARK_[A-Z0-9]{12,32}$"},
        "cancel_marker": {"type": "string", "pattern": "^W4MARK_[A-Z0-9]{12,32}$"},
        "cancel_barrier": {"type": "string", "minLength": 1},
        "progress_token": {"type": "string", "minLength": 1},
        "reuse_after_cancel": {"const": true},
        "cancel_audit": {"const": true},
        "lock_sql": {"type": "string", "minLength": 1},
        "cancel_mutation_audit": {"const": true},
        "cancel_after_completion": {"const": true},
        "retry": {"type": "boolean"}, "retry_expect": {"type": "object"},
        "mutation": {"type": "boolean"},
        "parallel": {"type": "array", "minItems": 2, "maxItems": 8,
          "items": {"type": "object", "required": ["arguments", "expect"],
            "properties": {"arguments": {"type": "object"}, "expect": {"type": "object"},
              "plan_contains": {"type": "string", "minLength": 1}}}}
      }},
      "expect": {"type": "object", "minProperties": 1,
        "properties": {"goldens": {"type": "array", "minItems": 2, "maxItems": 2,
          "items": {"type": "string", "pattern": "^[a-zA-Z0-9_.-]+\\.json$"}}}},
      "cleanup": {"type": "array", "items": {"type": "object", "additionalProperties": false,
        "required": ["sql"], "properties": {"sql": {"type": "string", "minLength": 1}}}},
      "expect_by_version": {"type": "object", "additionalProperties": false,
        "required": ["23", "pre23"], "properties": {
          "23": {"type": "object", "minProperties": 1},
          "pre23": {"type": "object", "minProperties": 1}}},
      "db_reread": {"type": "array", "items": {"type": "object", "required": ["sql", "rows"]}},
      "audit_expect": {"type": "array", "items": {"type": "object", "required": ["tool", "decision", "outcome"]}},
      "audit_zero_executions": {"type": "boolean"},
      "on_unsupported": {"type": "object", "required": ["error_class"]}
    }
  }
}
